### ISSUE TITLE
redirect.t test failure

### ISSUE THREAD

**Issue by abraxxa** [libwww-perl/libwww-perl#370]
On Debian 10 with system Perl 5.28.1:

```
PERL_DL_NONLAZY=1 "/usr/bin/perl" "-MExtUtils::Command::MM" "-MTest::Harness" "-e" "undef *Test::Harness::Switches; test_harness(0, 'blib/lib', 'blib/arch')" t/*.t t/base/*.t t/base/protocols/*.t t/leak/*.t t/local/*.t t/robot/*.t
# 
# Versions for all modules listed in MYMETA.json (including optional ones):
# 
# === Configure Requires ===
# 
#     Module                       Want     Have
#     ------------------------ -------- --------
#     CPAN::Meta::Requirements 2.120620    2.140
#     ExtUtils::MakeMaker           any     7.34
#     File::Copy                    any     2.33
#     Getopt::Long                  any      2.5
#     Module::Metadata              any 1.000033
# 
# === Build Requires ===
# 
#     Module              Want Have
#     ------------------- ---- ----
#     ExtUtils::MakeMaker  any 7.34
# 
# === Test Requires ===
# 
#     Module                 Want     Have
#     ---------------------- ---- --------
#     ExtUtils::MakeMaker     any     7.34
#     File::Spec              any     3.74
#     FindBin                 any     1.51
#     Test::Fatal             any    0.016
#     Test::More             0.96 1.302133
#     Test::Needs             any 0.002006
#     Test::RequiresInternet  any     0.05
# 
# === Test Recommends ===
# 
#     Module              Want     Have
#     --------------- -------- --------
#     CPAN::Meta      2.120900 2.150010
#     Test::LeakTrace      any  missing
# 
# === Runtime Requires ===
# 
#     Module                Want Have
#     --------------------- ---- ----
#     Digest::MD5            any 2.55
#     Encode                2.12 2.97
#     Encode::Locale         any 1.05
#     File::Listing            6 6.14
#     HTML::Entities         any 3.69
#     HTML::HeadParser       any 3.71
#     HTTP::Cookies            6 6.10
#     HTTP::Daemon             6 6.12
#     HTTP::Date               6 6.02
#     HTTP::Negotiate          6 6.01
#     HTTP::Request            6 6.18
#     HTTP::Request::Common    6 6.18
#     HTTP::Response           6 6.18
#     HTTP::Status          6.18 6.18
#     IO::Select             any 1.39
#     IO::Socket             any 1.39
#     LWP::MediaTypes          6 6.02
#     MIME::Base64           2.1 3.15
#     Net::FTP              2.58 3.11
#     Net::HTTP             6.18 6.20
#     Scalar::Util           any 1.50
#     Try::Tiny              any 0.30
#     URI                   1.10 1.76
#     URI::Escape            any 3.31
#     WWW::RobotRules          6 6.02
#     base                   any 2.27
#     strict                 any 1.11
#     warnings               any 1.42
# 
# === Runtime Suggests ===
# 
#     Module               Want    Have
#     -------------------- ---- -------
#     Authen::NTLM         1.02 missing
#     Data::Dump           1.13 missing
#     IO::Socket::INET      any    1.39
#     LWP::Protocol::https 6.02 missing
# 
t/00-report-prereqs.t .......... ok
t/10-attrs.t ................... ok
# Some tests for the PUT/PATCH methods can only be run on 
# HTTP::Request version 6.07/6.12 or higher.
# If your version isn't good enough, we'll skip those.
# Your version is 6.18 and that's good enough
t/base/default_content_type.t .. ok
t/base/protocols.t ............. ok
t/base/protocols/nntp.t ........ skipped: nntp.perl.org is unstable and Test::RequiresInternet is not catching it
t/base/proxy.t ................. ok
t/base/simple.t ................ ok
t/base/ua.t .................... ok
t/base/ua_handlers.t ........... ok
t/leak/no_leak.t ............... skipped: Need Test::LeakTrace
t/local/autoload-get.t ......... ok
t/local/autoload.t ............. ok
t/local/get.t .................. ok
t/local/http.t ................. ok
t/local/httpsub.t .............. ok
t/local/protosub.t ............. ok

#   Failed test '... and has tells us about the problem'
#   at t/redirect.t line 39.
#                   'read timeout at /opt/radiator/perl-modules/lib/perl5/Net/HTTP/Methods.pm line 268.
# '
#     doesn't match '(?^i:Can't connect)'

#   Failed test '... and has tells us about the problem'
#   at t/redirect.t line 56.
#                   'read timeout at /opt/radiator/perl-modules/lib/perl5/Net/HTTP/Methods.pm line 268.
# '
#     doesn't match '(?^i:Can't connect)'
# Looks like you failed 2 tests of 4.
t/redirect.t ................... 
Dubious, test returned 2 (wstat 512, 0x200)
Failed 2/4 subtests 
t/robot/ua-get.t ............... ok
t/robot/ua.t ................... ok

Test Summary Report
-------------------
t/redirect.t                 (Wstat: 512 Tests: 4 Failed: 2)
  Failed tests:  2, 4
  Non-zero exit status: 2
Files=19, Tests=269, 17 wallclock secs ( 0.10 usr  0.02 sys +  2.84 cusr  0.41 csys =  3.37 CPU)
Result: FAIL
Failed 1/19 test programs. 2/269 subtests failed.
make: *** [Makefile:1003: test_dynamic] Error 255
```

**Comment by oalders** [comment]
Is there anything listening on `198.51.100.123`?

**Comment by abraxxa** [comment]
As this is a reserved IPv4 test network, no.

**Comment by oalders** [comment]
I'm just wondering why there's a read timeout rather than a "can't connect" here.

**Comment by abraxxa** [comment]
This is a tcpdump output:

```
root@debian10:~# tcpdump -i enp1s0 host 198.51.100.123 -vvnn 
tcpdump: listening on enp1s0, link-type EN10MB (Ethernet), capture size 262144 bytes
14:30:34.960661 IP (tos 0x0, ttl 64, id 36878, offset 0, flags [DF], proto TCP (6), length 60)
    192.168.122.254.58536 > 198.51.100.123.80: Flags [S], cksum 0x6684 (incorrect -> 0xe02f), seq 1889582189, win 64240, options [mss 1460,sackOK,TS val 3511493429 ecr 0,nop,wscale 7], length 0
14:30:34.970758 IP (tos 0x0, ttl 254, id 52689, offset 0, flags [DF], proto TCP (6), length 60)
    198.51.100.123.80 > 192.168.122.254.58536: Flags [S.], cksum 0x9cc4 (correct), seq 3962555666, ack 1889582190, win 4380, options [mss 1336,nop,wscale 0,sackOK,TS val 4140465572 ecr 3511493429], length 0
14:30:34.970803 IP (tos 0x0, ttl 64, id 36879, offset 0, flags [DF], proto TCP (6), length 52)
    192.168.122.254.58536 > 198.51.100.123.80: Flags [.], cksum 0x667c (incorrect -> 0xda29), seq 1, ack 1, win 502, options [nop,nop,TS val 3511493439 ecr 4140465572], length 0
14:30:34.992549 IP (tos 0x0, ttl 64, id 36880, offset 0, flags [DF], proto TCP (6), length 169)
    192.168.122.254.58536 > 198.51.100.123.80: Flags [P.], cksum 0x66f1 (incorrect -> 0xffae), seq 1:118, ack 1, win 502, options [nop,nop,TS val 3511493461 ecr 4140465572], length 117: HTTP, length: 117
	GET / HTTP/1.1
	TE: deflate,gzip;q=0.3
	Connection: TE, close
	Host: 198.51.100.123
	User-Agent: libwww-perl/6.52
	
14:30:35.001657 IP (tos 0x0, ttl 254, id 53178, offset 0, flags [DF], proto TCP (6), length 52)
    198.51.100.123.80 > 192.168.122.254.58536: Flags [.], cksum 0xcace (correct), seq 1, ack 118, win 4263, options [nop,nop,TS val 4140465603 ecr 3511493461], length 0
14:30:35.994079 IP (tos 0x0, ttl 64, id 36881, offset 0, flags [DF], proto TCP (6), length 52)
    192.168.122.254.58536 > 198.51.100.123.80: Flags [F.], cksum 0x667c (incorrect -> 0xd595), seq 118, ack 1, win 502, options [nop,nop,TS val 3511494462 ecr 4140465603], length 0
14:30:35.999851 IP (tos 0x0, ttl 64, id 21773, offset 0, flags [DF], proto TCP (6), length 60)
    192.168.122.254.58538 > 198.51.100.123.80: Flags [S], cksum 0x6684 (incorrect -> 0xd77f), seq 3142612572, win 64240, options [mss 1460,sackOK,TS val 3511494468 ecr 0,nop,wscale 7], length 0
14:30:36.003432 IP (tos 0x0, ttl 254, id 750, offset 0, flags [DF], proto TCP (6), length 52)
    198.51.100.123.80 > 192.168.122.254.58536: Flags [.], cksum 0xc2fc (correct), seq 1, ack 119, win 4262, options [nop,nop,TS val 4140466604 ecr 3511494462], length 0
14:30:36.008226 IP (tos 0x0, ttl 254, id 813, offset 0, flags [DF], proto TCP (6), length 60)
    198.51.100.123.80 > 192.168.122.254.58538: Flags [S.], cksum 0xb086 (correct), seq 3142311286, ack 3142612573, win 4380, options [mss 1336,nop,wscale 0,sackOK,TS val 4140466610 ecr 3511494468], length 0
14:30:36.008325 IP (tos 0x0, ttl 64, id 21774, offset 0, flags [DF], proto TCP (6), length 52)
    192.168.122.254.58538 > 198.51.100.123.80: Flags [.], cksum 0x667c (incorrect -> 0xeded), seq 1, ack 1, win 502, options [nop,nop,TS val 3511494476 ecr 4140466610], length 0
14:30:36.009384 IP (tos 0x0, ttl 64, id 21775, offset 0, flags [DF], proto TCP (6), length 169)
    192.168.122.254.58538 > 198.51.100.123.80: Flags [P.], cksum 0x66f1 (incorrect -> 0x1388), seq 1:118, ack 1, win 502, options [nop,nop,TS val 3511494477 ecr 4140466610], length 117: HTTP, length: 117
	GET / HTTP/1.1
	TE: deflate,gzip;q=0.3
	Connection: TE, close
	Host: 198.51.100.123
	User-Agent: libwww-perl/6.52
	
14:30:36.017518 IP (tos 0x0, ttl 254, id 944, offset 0, flags [DF], proto TCP (6), length 52)
    198.51.100.123.80 > 192.168.122.254.58538: Flags [.], cksum 0xdebd (correct), seq 1, ack 118, win 4263, options [nop,nop,TS val 4140466619 ecr 3511494477], length 0
14:30:37.011193 IP (tos 0x0, ttl 64, id 21776, offset 0, flags [DF], proto TCP (6), length 52)
    192.168.122.254.58538 > 198.51.100.123.80: Flags [F.], cksum 0x667c (incorrect -> 0xe983), seq 118, ack 1, win 502, options [nop,nop,TS val 3511495479 ecr 4140466619], length 0
14:30:37.019923 IP (tos 0x0, ttl 254, id 13830, offset 0, flags [DF], proto TCP (6), length 52)
    198.51.100.123.80 > 192.168.122.254.58538: Flags [.], cksum 0xd6e9 (correct), seq 1, ack 119, win 4262, options [nop,nop,TS val 4140467621 ecr 3511495479], length 0
14:30:43.981422 IP (tos 0x0, ttl 254, id 47765, offset 0, flags [DF], proto TCP (6), length 40)
    198.51.100.123.80 > 192.168.122.254.58536: Flags [R.], cksum 0x7db9 (correct), seq 1, ack 119, win 0, length 0
14:30:48.018003 IP (tos 0x0, ttl 254, id 40063, offset 0, flags [DF], proto TCP (6), length 40)
    198.51.100.123.80 > 192.168.122.254.58538: Flags [R.], cksum 0x9998 (correct), seq 1, ack 119, win 0, length 0
```

My guess is that our layer 3 firewall intercepts the tcp three-way handshake to find out the URL.
Changing it to http://127.0.0.255 makes the test pass and should be a safer alternative as the packets won't leave the host.

**Comment by oalders** [comment]
Are you able to share the output from `ip addr`?

**Comment by abraxxa** [comment]
This is a testing VM so not interesting/useful:

```
root@debian10:~# ip addr
1: lo: <LOOPBACK,UP,LOWER_UP> mtu 65536 qdisc noqueue state UNKNOWN group default qlen 1000
    link/loopback 00:00:00:00:00:00 brd 00:00:00:00:00:00
    inet 127.0.0.1/8 scope host lo
       valid_lft forever preferred_lft forever
    inet6 ::1/128 scope host 
       valid_lft forever preferred_lft forever
2: enp1s0: <BROADCAST,MULTICAST,UP,LOWER_UP> mtu 1500 qdisc pfifo_fast state UP group default qlen 1000
    link/ether 52:54:00:32:1a:00 brd ff:ff:ff:ff:ff:ff
    inet 192.168.122.254/24 brd 192.168.122.255 scope global dynamic enp1s0
       valid_lft 2163sec preferred_lft 2163sec
    inet6 fe80::5054:ff:fe32:1a00/64 scope link 
       valid_lft forever preferred_lft forever
```

**Comment by oalders** [comment]
So, we chose that IP specifically because it's reserved for documentation. I'm not sure what kind of contortions we want to go through to account for various networking issues. I don't think we can guarantee that something won't listen on http://127.0.0.255 I guess we could try various fallback IPs, but I'm not sure this is a really critical test to run locally.

Is it reasonable for you to set `NO_NETWORK_TESTING` here? That should allow the tests to pass.

**Comment by abraxxa** [comment]
I'm a network security engineer, I feel your pain!
The probability that loopback communication fails (differently than you expect) is way lower than in a production network which gets more complex every day, in contrary to what the vendor-SD-whatever-fairy tells you.
Most hosts have a default gateway which results in a packet being sent out that might get blocked, replied with a reset or even syn-ack by a firewall or other proxy/url-filter/call-it-what-you-want.

Thanks for the `NO_NETWORK_TESTING` hint, is this env var anywhere documented?

**Comment by oalders** [comment]
That's helpful information. I will leave this ticket open for the time being, then.

As far as `NO_NETWORK_TESTING` goes, the original discussion is here: https://www.nntp.perl.org/group/perl.cpan.workers/2014/06/msg1117.html 

This var is used by https://metacpan.org/pod/Test::RequiresInternet

I see that we have referenced it in the test as well: https://github.com/libwww-perl/libwww-perl/blob/master/t/redirect.t#L8-L11

**Comment by abraxxa** [comment]
I see no way to set this env var just for that single test.
Do you think that changing the IP to a loopback one will decrease the passing test rate?

**Comment by oalders** [comment]
I was thinking of setting that var for the entire test run, rather than for just the one test.

Having said that, it looks like we previously used `http://10.255.255.1` for this test. That changed in 63bbe49114eecbd5.

**Comment by oalders** [comment]
I just asked a colleague and his response was:

```
curl 127.0.0.255
<html>
<head><title>401 Authorization Required</title></head>
<body bgcolor="white">
<center><h1>401 Authorization Required</h1></center>
<hr><center>nginx/1.14.2</center>
</body>
</html>
```

**Comment by abraxxa** [comment]
On my Ubuntu 20.10: 
```
curl 127.0.0.255
curl: (7) Failed to connect to 127.0.0.255 port 80: Connection refused
```

**Comment by abraxxa** [comment]
Is there any progress on this issue?

**Comment by oalders** [comment]
As far as I can tell, the best option here is to enable `NO_NETWORK_TESTING` when installing this module. The IP used in the test is documented as reserved for testing, so I'm more comfortable using that than an IP which is not documented as reserved. I guess someone could rewrite the test to try several fallback IPs? @skaji thoughts on this?

**Comment by johannessen** [comment]
I experienced the same issue today and got curious. In my case, it seems to be caused by the LAN home router (an old B593).

The IP in the test, `198.51.100.123`, is a TEST-NET-2 address. My guess is that particular router doesn’t recognise this as a non-routeable address and forwards the packets to the ISP, which immediately drops the packets, as TEST-NET-2 addresses shouldn’t appear on the internet (as recommended in [RFC 5737](https://datatracker.ietf.org/doc/html/rfc5737#section-4)). Hence, a timeout.

When I change `redirect.t` to use the IP `233.252.0.123`, a MCAST-TEST-NET address ([RFC 5771](https://datatracker.ietf.org/doc/html/rfc5771#section-9.2)), the tests are successful. Apparently the router doesn’t forward packages for that address.

Furthermore, [RFC 6676](https://datatracker.ietf.org/doc/html/rfc6676#section-2.3) specifically suggests the IP `234.198.51.100`, a multicast address for documentation use derived from TEST-NET-2 with the method described in [RFC 6034](https://datatracker.ietf.org/doc/html/rfc6034#section-3). In my network, the tests also succeed for this address.

Might changing the IP to `233.252.0.123` or `234.198.51.100` resolve this issue for others as well?

**Comment by oalders** [comment]
Sure, why don't we try `234.198.51.100`?
